MCQ,Choices,Correct
Who coined the term 'machine learning'?,a: Donald Hebb | b: Walter Pitts | c: Arthur Samuel | d: Tom M. Mitchell,c
In what decade was the earliest machine learning model introduced?,a: 1940s | b: 1950s | c: 1960s | d: 1970s,b
What was the name of the 'learning machine' developed by Raytheon Company in the early 1960s?,a: The Neural Net | b: Cybertron | c: The Hebb Machine | d: Pattern Analyzer,b
"According to Tom M. Mitchell's definition, what are the three key elements in machine learning?","a: Data, Algorithms, and Results | b: Experience, Tasks, and Performance | c: Inputs, Outputs, and Processing | d: Training, Testing, and Validation",b
What are the two main objectives of modern-day machine learning?,a: Data storage and retrieval | b: Data classification and future prediction | c: Algorithm optimization and deployment | d: Human cognitive process and neural network creation,b
